{
  "report_id": "TOOLPACK-20260522-EXAMPLE",
  "status": "pass",
  "selected_workflow_strengthening_slice": "tool_packaging_contracts",
  "decision_space": [
    {
      "option_id": "option-a",
      "title": "Land the tool packaging family.",
      "why_now": "The gap map already names missing schemas and examples for this lane.",
      "evidence_refs": [
        "evaluation/gap-map-strength-report.json"
      ]
    },
    {
      "option_id": "option-b",
      "title": "Land subsystem runner proof first.",
      "why_now": "Runner probes would strengthen activation truth but still leave tool packaging as prose.",
      "evidence_refs": [
        "contracts/subsystem-harness-topology.yaml"
      ]
    },
    {
      "option_id": "option-c",
      "title": "Land persistence contracts first.",
      "why_now": "Persistence is important but depends on packaging rows and artifact shapes staying stable.",
      "evidence_refs": [
        "inbox/prompting-tools.consume/Prompt Tools — Pixeltable DuckDB Artifact Store f1f2f37e23014613b0326f67c634f87f.md"
      ]
    }
  ],
  "recommended_option_id": "option-a",
  "iteration_count": 2,
  "iteration_score_history": [
    {
      "iteration": 1,
      "summary": "Land the contract family and validator coverage.",
      "before_total_score": 99.62,
      "after_total_score": 99.62,
      "score_changed": false
    },
    {
      "iteration": 2,
      "summary": "Add a machine-verifiable report contract for the slice.",
      "before_total_score": 99.62,
      "after_total_score": 99.62,
      "score_changed": false
    }
  ],
  "infranodus_path_used": {
    "mode": "bounded_local_cli_substitute",
    "command": "uv run python scripts/build-parent-infranodus-artifacts.py",
    "evidence_refs": [
      "evaluation/infranodus-gap-analysis.json",
      "evaluation/tool-health/infranodus-live-probe.json"
    ]
  },
  "stronger_content_summary": [
    "Prompt-to-tool packaging now has parent-owned schemas and valid examples."
  ],
  "still_weak_content_summary": [
    "Pixeltable and DuckDB remain blocked as live persistence lanes."
  ],
  "runnable_tool_shortlist_used": [
    "gh copilot",
    "codex",
    "gitnexus",
    "graphify"
  ],
  "files_changed": [
    "contracts/tool-packaging-family.yaml",
    "schemas/tool-spec.schema.json"
  ],
  "targeted_validation_results": [
    {
      "command": "uv run --isolated --with jsonschema --with pyyaml python tests/validate_parent_wrapper_contract.py",
      "status": "pass",
      "evidence_refs": [
        "evaluation/validation-report.json"
      ]
    }
  ],
  "runtime_truth": {
    "runtime_truth_level": "bounded_runtime",
    "active_parent_runtime_lanes": [
      "peer_mesh_local.same_host",
      "inbox_protocol.same_host"
    ],
    "blocked_parent_runtime_lanes": [
      {
        "lane_id": "peer_mesh_local.cross_device",
        "classification": "blocked_with_exact_dependency",
        "blocker_dependency": "PI_COMS_NET_AUTH_TOKEN and a declared hub URL remain required before cross-device peer mesh can be promoted.",
        "evidence_refs": [
          "evaluation/tool-health/peer-mesh-local.json"
        ]
      }
    ],
    "activation_artifacts_used": [
      "evaluation/tool-health/peer-mesh-local.json"
    ],
    "non_activated_subsystem_lanes": [
      "intake_etl",
      "research_harvest",
      "semantic_cartography",
      "wrapper_synthesizer"
    ],
    "do_not_overclaim_notes": [
      "Do not imply live persistence or subsystem activation from packaging contracts alone."
    ]
  },
  "freshness": {
    "artifact_records": [
      "evaluation/validation-report.json",
      "evaluation/metrics-latest.json"
    ],
    "max_artifact_span_seconds": 600,
    "tool_health_artifacts": [
      "evaluation/tool-health/status.json"
    ],
    "compiled_research_artifacts": [
      "evaluation/research/compiled/feature-matrix.json"
    ],
    "infranodus_artifacts": [
      "evaluation/infranodus-gap-analysis.json"
    ]
  },
  "score_saturation": {
    "baseline_total_score": 99.62,
    "final_total_score": 99.62,
    "score_changed": false,
    "why_this_slice_counts": "The machine-verifiable family closes a weak-content lane even before the broader program score moves.",
    "flat_score_explanation": "The scorer remained flat because iteration freshness and ledger alignment had not yet been refreshed for this run."
  },
  "command_evidence": {
    "activation_commands": [
      "bash scripts/run-parent-peer-mesh-local.sh",
      "uv run python scripts/watchers/inbox_router.py"
    ],
    "validation_commands": [
      "uv run --isolated --with jsonschema --with pyyaml python tests/validate_parent_wrapper_contract.py",
      "uv run --isolated --with jsonschema --with pyyaml python scripts/score-parent-wrapper.py --json"
    ],
    "tool_health_commands": [
      "uv run python scripts/build-parent-infranodus-artifacts.py"
    ],
    "infranodus_commands": [
      "uv run python scripts/build-parent-infranodus-artifacts.py"
    ],
    "research_commands_or_reads": [
      "Read evaluation/gap-map-strength-report.json",
      "Read inbox/prompting-tools.consume/Prompt Tools — Tool Catalog (Prompt → Tool) 93e64081b83745deb9793ba0266585f8.md"
    ]
  },
  "follow_up_prompt": {
    "artifact_path": "prompts/PROMPT-20260522-SUBSYSTEM-RUNNER-PROOF.yaml",
    "target_schema_ref": "agent-heavy-run-prompt.schema.json",
    "target_template_ref": "agent-heavy-run-prompt.template.yaml",
    "must_be_inline_ready": true,
    "next_decision_space": "Choose whether subsystem_runner_proof, pixeltable_duckdb_persistence, or consume_source_quality is the next bounded slice.",
    "markdown_companion_artifact_path": "prompts/PROMPT-20260522-SUBSYSTEM-RUNNER-PROOF.md",
    "must_use_front_matter": true,
    "must_use_bottom_matter_marker": true
  }
}
